category,product_title,description,directions,warning,goals,about,url
Whey Protein Isolate,Amazing Nutrition Amazing Formulas Grass-Fed Whey Isolate,"Amazing formulas, grass fed whey protein isolate is a rich source of essential amino acids, which are the building blocks of protein and imprtant for those with an active lifestyle. Protein is a vital nutrient and responsible for building and repairing cells, muscle and producing energy for the body. The body requires higher amounts of protein during and after excersive to fuel the muscles,Read more","On training days, mix two (2) scoops in 12-16 oz. of water or a carbohydrate based post-workout beverage within 30 minutes of your workout. On non-training days, use one (1) scoop 1-3 times daily, in between or in addition to meals as a dietary supplement.","Use this product as a food supplement. Do not use for weight reduction. This product is only intended to be consumed by healthy individuals 18 years or older. Consult a physician if you are pregnant or nursing, taking any medications or have any medical condition. Do not exceed recommended use Improper use will not improve results. Discontinue use and seek professional assistance immediately f you experience unwanted side effects. Discontinue use two weeks prior to surgery.","ENCOURAGE MUSCLE GROWTH, SUPPORTS ENERGY PRODUCTION , SUPPORTS SWIFTER WORKOUT RECOVERY","Amazing Formulas&#8217; will have you living well and feeling better! We offer the finest selection of supplements, which can perfectly complement a healthy diet and active lifestyle. &#8216;Amazing Formulas™&#8217; helps you create a strong nutritional foundation with simple, clean yet effective formulas.",https://shop.bodybuilding.com/products/amazing-formulas-grass-fed-whey-isolate
Plant Protein,Thentic Plant Protein,"All plant protein is not created equal, our protein consists of pea protein isolate, the most bioavailable and easily digestible form of the plant based protein. Our unique blend of digestive enzymes will help prompt improved digestion and gut health. Power your body with clean protein, organic superfoods and a complete amino acid profile with no artificial colors, dyes, or sweeteners.

Thentic's plant protein powder contains 24 grams of Pea Protein and 5.8g of BCAAs, helping you improve muscle health and recover after every workout. We pride ourselves on rigorous quality and safety tests. All supplements are tested for quality, safety, and purity; every batch tested internally for consistency, quality, and flavor. Expect the best from our Plant Protein. Formulated, blended, and packaged in the USA.Read more","As a dietary supplement, mix one scoop with 12 oz. of cold water or your preferred beverage of choice. Consume after each training session or based around your individual needs for protein consumption.","Pregnant or nursing mothers, children under the age of 18, and individuals with a known medical condition should consult a licensed and qualified physician before using this or any dietary supplement.SHIPPING WARNING                                                                                                                                                                                    This product will not ship to the following locations due to restrictions:Croatia, Belgium, Denmark, Ireland, Mauritius, Serbia, Turkey, Cuba, Greece, Lithuania, Poland, Spain, Canada, France, Latvia, New Zealand, Slovenia, Austria, Czech Republic, Iceland, Malta, Romania, Switzerland, Australia, Cyprus, Hungary, Luxembourg, Portugal, Sweden, Bosnia and Herzegovina, Estonia, Italy, Montenegro, Singapore, United Arab Emirates, Bulgaria, Finland, Japan, Netherlands, Slovakia, United Kingdom, Germany, Liechtenstein, Norway, South Korea* These statements have not been evaluated by the Food and Drug Administration. This product is not intended to diagnose, treat, cure, or prevent any disease.","PLANT PROTEIN:  All plant protein is not created equal, our protein consists of pea protein isolate, the most bioavailable and easily digestible form of the plant based protein. With zero artificial sweeteners, colors or added sugar it&#8217;s a great choice for the health conscious fitness enthusiast.SUPPORT MUSCLE GROWTH &amp; RECOVERY:  Thentic&#8217;s plant protein powder contains 24 grams of Pea Protein and 5.8g of BCAAs, helping you improve muscle health and recover after every workout.DIGESTIVE ENZYMES + ORGANIC SUPERFOODS: Our unique blend of digestive enzymes will help promote improved digestion and gut health. Don&#8217;t forget your fruits and veggies! Each serving contains 5.2g of nutrient dense superfoods to help boost vitamin and mineral consumption and powerful antioxidants.CLEAN INGREDIENTS: Vegan, Gluten Free, Soy Free and Keto Friendly. You can trust you are receiving high-quality ingredients for optimal health and muscle recovery in every container of Thentic plant protein.AMERICAN MADE: Thentic prides itself on rigorous quality and safety tests. All supplements are tested for quality, safety, and purity; every batch tested internally for consistency, quality, and flavor. Expect the best from our Plant Protein. Formulated, blended, and packaged in the USA.100% SATISFACTION GUARANTEED: At Thentic, our passion is to help you accomplish your fitness goals! We design every product with the health conscious fitness enthusiast in mind who is looking to live to a higher standard. If you are not completely satisfied with any of our products, please let our customer service team know.","There&#8217;s nothing ordinary about achieving something extraordinary. Thentic is inspired by those who&#8217;ve overcome a detrimental setback in their life. This drive to prevail against all odds powers everything we do. Every product is created by Alisha, a certified personal trainer and nutrition coach, while Taylor, a licensed pharmacist formulates and validates its efficacy, quality and integrity. It&#8217;s why we use exceptional ingredients. We only get one body, we&#8217;re determined to treat it right. There&#8217;s nothing artificial about optimizing performance with Thentic.",https://shop.bodybuilding.com/products/thentic-plant-protein
Plant Protein,SNAP Supplements Vegan Protein,"Take full control of your muscle growth, performance, and recovery with our 100% plant-based protein powder. This supplement is made with only the cleanest ingredients and amino acids derived exclusively from brown rice, yellow peas, and lentils to provide you with a complete source of vegan protein that blends seamlessly into hot or cold liquids for a silky smooth taste every time.

21 grams of plant-based protein per serving.
Contains all 9 essential amino acids.
No chalky, gritty texture.
No added sugars or artificial sweeteners.Read more","RECOMMENDATIONS: Two scoops directly into 8-12 oz of water or yourfavorite beverage. Blend, shake or briskly stir until fully dissolved. Storeaway from humidity, heat, and light. Do not refrigerate. If any reactionsoccur, discontinue use of dietary supplement and consult your doctor.","WARNING: Pregnant or nursing mothers, children under the age of 18,and individuals with known medical condition should consult a physicianbefore using this or any dietary supplement. California Residents:WARNING Reproductive Harm www.P65Warnings.ca.gov",".21 grams of plant-based protein per serving.Contains all 9 essential amino acids.No chalky, gritty texture.No added sugars or artificial sweeteners.","Snap Supplements was founded by three friends who immigrated to the United States from developing countries in the early 1990s. Concepts like nutrition or supplements were foreign to them, for they had been raised on foods that came from their backyard gardens and neighbors&#8217; organic farms. They relied on local, natural foods and homegrown herbal remedies crafted with transgenerational wisdom to treat illnesses and nourish their bodies, never having to worry about whether they were getting the nutrients they needed. Not long after arriving in the United States, Snap Supplements Co-Founder Max began noticing how the standard Western diet &#8220;full of processed foods and lacking in quality nutrients&#8221; was negatively affecting his family&#8217;s health. As his family experienced weight gain, allergies, and heart diseases so common in the Western world, Max was inspired to begin his journey sharing how food could be used as medicine. Today, the Snap Supplements team continues to leverage Max&#8217;s food is medicine philosophy to produce the highest quality supplements crafted with the conflation of modern science and ancient wisdom that exists at the root of the company.",https://shop.bodybuilding.com/products/snap-supplements-vegan-protein
Plant Protein,Legion Plant+ All Natural Plant Protein Powder,Get our 100% natural and vegan-friendly plant-based protein powder with a premium blend of rice and pea protein and no animal-derived ingredients or added sugars.Read more,Mix with 8 oz of water,,,"Bestselling author Mike Matthews founded Legion to create healthy, high-quality sport supplements based on sound science, and to sell them honestly and at a fair price.",https://shop.bodybuilding.com/products/legion-plant-plus-all-natural-plant-protein-powder
Plant Protein,,,,,,,https://shop.bodybuilding.com/products/komplex-nutrition-plant-based-protein
Plant Protein,,,,,,,https://shop.bodybuilding.com/products/portions-master-vegan-protein-blend
Plant Protein,,,,,,,https://shop.bodybuilding.com/products/portions-master-plant-protein
Plant Protein,,,,,,,https://shop.bodybuilding.com/products/ryno-power-plant-based-protein-powder
Plant Protein,Amazing Nutrition Amazing Formulas Pea Protein Powder,"Pea protein powder is an excellent source of both protein and the amino acid, L-arginine. Pea protein is extracted from the yellow pea, which is naturally abundant in that all important protein. It is coming to light through expert research that raw pea protein can benefit the body in a number of ways, especially if the person consuming it is pursuing athletic endeavors like a regular workout. These benefits include: APPETITE SUPPRESSANT. Aid in healthy weight management with pea powder protein by suppressing the hormone ghrelin that tells the body it is hungry.Read more","Stir up, shake up or blend one (1 scoop (44 g) daily to 10 ounces of cold water,juice, or your favorite beverage. Take your protein drink 30 minutes after workouts or as directed by a practitioner. For best results, consume enough proteins to meet your day protein requirement through a combination of high protein foods and Amazing Nutrition Pea Protein Supplement.","Use this product as a food supplement. Do not use for weight reducion.This product is ony intended to be consumed by a healthy individuals 18 years or older. Consult a physician if you are pregnant or nursing, taking any medication or have any medical condtition. Do not exceed recommended use. Improper use will not improve results. Discontinue and seek professional assistance immediately if you experience unwanted side effects. Discontinue use two weeks prior surgery.",Supports Enery Production and muscle Growth. Supports Lean Muscle Growth and rapid Recovery. Promotes Heart and kidney Functions.,"Amazing Formulas&#8217; will have you living well and feeling better! We offer the finest selection of supplements, which can perfectly complement a healthy diet and active lifestyle. &#8216;Amazing Formulas&#8217; helps you create a strong nutritional foundation with simple, clean yet effective formulas.",https://shop.bodybuilding.com/products/amazing-nutrition-amazing-formulas-pea-protein-powder
Protein Bars,,,,,,,https://shop.bodybuilding.com/products/sport-pux-bar
Protein Bars,Performance Inspired Nutrition Inspired-Bar 2.0,"Our improved Inspired-Bar 2.0 20g protein bar sets a higher standard for functional, filling, clean, and delicious nutrition! We added a delicious chocolate layer to turbocharge the taste while still providing a superior protein bar with a robust and meaningful formula! Wholesome natural nutrition that will make you feel like you're cheating . . . but you're not!! Compare this impressive formula, and you will add it to your fitness, diet, and healthy lifestyle regimen!Read more",Open & Enjoy!,"Made in a facility that processes peanuts, treenuts, soy, dairy, eggs, wheat, fish gelatin, andshellfish.","Mark Wahlberg&#8217;s favorite bar that&#8217;s the perfect go-to bar for any age, diet plan, and activity level! All-natural and wholesome ingredients with efficacious formulas people love.",,https://shop.bodybuilding.com/products/performance-inspired-nutrition-inspired-bar-2-0
Protein Bars,Performance Inspired Nutrition Protein Cookie,"Crush your cravings with this awesome-tasting protein cookie. Naturally sweetened with Stevia and Monk Fruit for a clean taste profile and a functional formula that will be your go-to healthy snack!  Filling, Delicious, and Satisfying Without Any Artificial Ingredients!  It's not a treat if it doesn't taste great..so we worked hard to find a good macro balance that took us months and many blind-comparison taste testing rounds to nail this formula!Read more",Open & Enjoy!,"ALLERGEN ALERT: CONTAINS MILK, PEANUTS, WHEAT, EGG, SOY LECITHIN. MANUFACTURED IN A FACILITY THAT PROCESSES TREE NUTS. STORE IN A COOL, DRY PLACE. THESE STATEMENTS HAVE NOT BEEN EVALUATED BY THE FOODAND DRUG ADMINISTRATION. THIS PRODUCT IS NOT INTENDEDTO DIAGNOSE, TREAT, CURE OR PREVENT ANY DISEASE.","These wholesome Protein Cookies provide you with the needed fuel to power through your day with healthy ingredients with a clean, natural taste you will love!   Make better snack choices with a BIG 14g-15g of Isolate Proteins, 6g-7g of filling Fiber in a BIG 71g satisfying cookie without Erythritol (sugar alcohol) that can upset many people&#8217;s digestive system.",,https://shop.bodybuilding.com/products/performance-inspired-nutrition-protein-cookie
Protein Bars,Legion Protein Cookies,"Get our all-natural protein cookies with a premium blend of whey and milk protein plus nutritious plant-based carbs, fats, and prebiotic fiber.Read more",Take as an any time snack or recovery from a workout,,Fitness and Health,"Bestselling author Mike Matthews founded Legion to create healthy, high-quality sport supplements based on sound science, and to sell them honestly and at a fair price.",https://shop.bodybuilding.com/products/legion-protein-cookies
STIMULANT FREE PRE-WORKOUT,Legion Pulse Pre Workout Stim Free,"Get the only 100% natural pre-workout supplement with clinically effective doses of six scientifically proven ingredients for more energy, focus, and strength without the jitters, upset stomach, or post-workout crash.Read more",Mix with 8 oz of water,,,"Bestselling author Mike Matthews founded Legion to create healthy, high-quality sport supplements based on sound science, and to sell them honestly and at a fair price.",https://shop.bodybuilding.com/products/legion-pulse-pre-workout-stim-free
STIMULANT FREE PRE-WORKOUT,,,,,,,https://shop.bodybuilding.com/products/ryno-power-endurance-capsules
STIMULANT FREE PRE-WORKOUT,MRI Performance NO2 Nitic Oxide,"Back by popular demand, our original NO2® Pills are back! Our special blend of L-arginine, alpha-ketoglutarate, Actinos®, and dihydrogenquercetin helps you sustain a superior perpetual pump.Read more",Take 1 serving with 8 to 12 oz of water as directed:  Men: Up to 200 LBS: 4 caplets 30 minutes before breakfast and again 30 minutes before lunch.  Over 200 LBS: 5 caplets 30 minutes before breakfast and again 30 minutes before lunch.   Women: Up to 125 LBS: 2 caplets 30 minutes before breakfast and again 30 minutes before lunch.   Over 125 LBS: 3 caplets 30 minutes before breakfast and again 30 minutes before lunch.,"Do not exceed recommended dose listed. This product is not intended for use by any persons under age 18, who are pregnant or lactating, or have serious medical conditions including high blood pressure and a history of cold sores, are taking prescription drugs, or have allergies to arginine, corn, or citrus fruit.  All persons should consult a physician or your healthcare professional before using dietary supplements, as individuals may have different supplemental needs. Consumption of this product that is inconsistent with recommended usage may produce adverse side effects. Discontinue use and contact a physician immediately if you experience any adverse symptoms.","Clinically tested to increase strength. Supports muscle regeneration after intense exercise, improves vascularity and promotes nutrient flow to working muscles.","At Medical Research Institute, our team of pros vet the most effective, high-quality compounds available. We offer clinically effective doses to help athletes power through workouts and life with explosive power and perpetual pumps! Our formulas are more potent. Our servings are stronger. Our quality is unmatched.",https://shop.bodybuilding.com/products/mri-performance-no2-nitic-oxide
STIMULANT FREE PRE-WORKOUT,MRI Performance NO2 Black,"Power through your training with pump, energy and vascularity. NO2 Black® Muscle + Pump is packed with S7, Nitrosigine and Hydromax to increase NO production, hydration and dilation to enhance blood flow to your muscles and fullness to your pump during your workouts.Read more","On training days, adhere to the servings below. For best results and to maximize NO2&reg; production, take your first serving with 4-6 oz of water on an empty stomach 0-30 minutes before a workout. Consume your second serving at least 6 hours before or after your pre-workout serving. Adjust water amount to desired consistency. As NO2 Black&reg; Muscle+Pump is highly concentrated, adhere to the below servings information.DAILY SERVINGSUp to 200 LBS: 1 serving (1 scoop) at least 30 minutes before eating or working out.Over 200 LBS: 2 servings (2 scoops) at least 30 minutes before eating or working out.","Do not exceed recommended dose listed. This product is not intended for use by any persons under age 18, who are pregnant or lactating, or have serious medical conditions including high blood pressure and a history of cold sores, are taking prescription drugs, or have allergies to arginine, corn, or citrus fruit.","Say goodbye to flat muscles during a workout. This powerful NO booster can help facilitate hyper pumps, stamina, and power! Welcome to max dosing of premium ingredients for ultimate muscle pumps!","At Medical Research Institute, our team of pros vet the most effective, high-quality compounds available. We offer clinically effective doses to help athletes power through workouts and life with explosive power and perpetual pumps! Our formulas are more potent. Our servings are stronger. Our quality is unmatched.",https://shop.bodybuilding.com/products/mri-performance-no2-black
STIMULANT FREE PRE-WORKOUT,ABE Pump Zero Stim,"Pre-Workout • Zero-StimABE PUMP represents our highest strength, stimulant-free, nootropic rich, ultra-pump formula for explosive focus, energy, and long-lasting muscle pumps throughout your most intense training sessions.Carefully formulated using highly regarded key ingredient compounding, along with several patented and trademarked, clinically trialed active ingredients that work to enhance your muscle pump activation, improve mental energy, and focus, and extend your workout potential.Designed to change the way you perform through enhanced training adaptation, keeping you focused and committed to your workout anytime of day or night.Read more",1 scoop (12.5g) or 2 scoops (25g) to 250ml – 500ml cold water 15-30 minutes prior to exercise.,"WARNINGS: Check with a qualified health professional before using this product if you are under the age of 18, pregnant or nursing a baby or if you have any known or suspected medical condition(s) and or are taking any prescription or OTC medication(s). Not to be used as a substitute for a varied diet and healthy lifestyle. Store this product in a cool dry place, away from children. Do not exceed suggested use.",,"ONLY THE BESTWe believe products should be free from unnecessary additives, and should only be made from the best ingredients. We are committed to bringing out the best in every athlete by producing clean, tested, and accredited supplements you can trust.",https://shop.bodybuilding.com/products/abe-no-stim-pump-powder
