category,product_title,description,directions,warning,goals,about,url
Whey Protein,Amazing Muscle Whey Protein,"AMAZING MUSCLE 100% WHEY PROTEIN powder is made by Whey Protein Isolate (WPI) as a primary ingredient along with ultra-filtered Whey Proten Concentrate (WPC). Whey Protein Isolate is one of the most complete forms of  protein supplements available, containing 90% protein or higher. It is processed to remove carbs, fats, cholesterol and lactose. Whey Protein isolate typically contains higher levels of leucine, valine and other amino acids.Read more","Take 1 scoop of AMAZING MUSCLE 100% Whey Protein with 6-7 oz. of water, nor your favorite beverage. Adjust the taste of your protein shake by varying the amount of liquid used. Take your protein shake 30 minutes after workouts or as directed by a health care professional. Consume enough proteins to meet your daily protein requirement through a combination of high protein food and amazing muscle. For best results, consume small protein-rich meals spread evenly throughout the day.  Shake Up; one of the best ways to have a mazing muscle whey protein shake is right after your routine, amazing muscle whey protein shake may help to fuel uo your muscles and assist with recovery from your workout. Simply pour the desired amount of liquid along with 1 scoop of amazing muscle whey protein into your shaker cup, cover and shake for 25-30 seconds. BLEND UP; Make your protein shake healthier, add a scoop of amazing muscle whey protein into a blender with the desired amount of liquid and blend for 20-30 seconds. Beyond a protein shake: amazing muscle whey protein is not only for liquids, it can also be used to make a variety of dishes from muffins to cupcakes, to burgers and lasagna, to dip, donuts and more. Simply add 1 or 2 scoops of whey protein to your favorite recipes. Amazing muscle  whey protein can be a part of your breakfast, lunch or dinner.","Use this product as food supplement, do not use for weight reduction. Keep out of reach of children.","Supports lean, muscle growth and workout recovery.","Amazing Muscle is a sports nutrition brand committed to offering clinically proven, safe and effective supplements to athletes and bodybuilders all over the world.We are passionate about bodybuilding and fitness! Which is why, we bring to you the best products that will help you build and improve on your strength, muscles, endurance, weight-loss, and help you achieve your dream body.",https://shop.bodybuilding.com/products/amazing-muscle-whey-protein-1
Whey Protein,Bodybuilding.com Signature 100% Whey Protein Powder,"Our Signature 100% Whey Protein combines three different sources of whey protein in one powerful blend: whey protein concentrate, whey protein isolate, and hydrolyzed whey protein. Whey protein is the most important weapon in your muscle-building arsenal. It promotes muscle growth, counteracts muscle breakdown, and supports your workout recovery.*

Signature 100% Whey Protein is perfect first thing in the morning, between meals, and especially after your workout. It's so delicious it'll can slay your sweet tooth without wrecking your macros.  It's a fantastic combination of value and quality. While many products are primarily whey protein concentrate, Signature 100% Whey has an impressive profile of 13 grams of isolate and 6 grams each of hydrolysate and concentrate. That means you have a lot of clean, quick-digesting, low-carb protein, with just enough whey concentrate for a creamy flavor and texture.

Simply put, it tastes really good. In reviews, customers rave about the delicious flavors with no artificial aftertaste. Mocha cappuccino and seasonal favorite oatmeal cookie are the most-praised flavors.

It's a versatile whey blend that can not only be easily mixed in a shaker bottle, but also added to a wide variety of recipes including waffles, cookies, and more. Many reviewers also find this product is easier to stomach than some of its competitors, likely due to the balanced protein blend.
*Packaging may vary*Read more","Mix one scoop (34 grams) with 6 ounces of water, milk, fruit juice or your favorite beverage. Ideally take one serving immediately following your workout. To modify the consistency of your protein, increase or decrease the liquid level to your liking.","WARNINGS: Consult your physician before using this product if you're taking any medications or are under a physician's care for a medical condition. Not for use by those under the age of 18 or by women who are pregnant, trying to become pregnant, or are nursing.* THESE STATEMENTS HAVE NOT BEEN EVALUATED BY THE FOOD AND DRUG ADMINISTRATION. THIS PRODUCT IS NOT INTENDED TO DIAGNOSE, TREAT, CURE, OR PREVENT ANY DISEASE.WARNING: Use this product as a food supplement only. Do not use for weight reduction. Store in a cool, dry place. Keep out of reach of children.CONTAINS SOY. Made in a facility that processes milk, wheat, soy, egg, and tree nuts species (coconut).","Protein is a key macronutrient for all fitness goals &#8211; whether it&#8217;s strength, endurance or body composition. Whey protein is the most important weapon in your muscle-building arsenal. It provides the nutrients you to promote muscle growth, counteract muscle breakdown, and support your workout recovery. Our protein bends three types of whey for ultimate muscle growth and recovery.. Protein also plays a vital part in immune health and supports healthy immune function.TIP: It&#8217;s a versatile whey blend that can not only be easily mixed in a shaker bottle, but also added to a wide variety of recipes including waffles, cookies, and more. Many reviewers also find this product easier to stomach than some of its competitors, likely due to the balanced protein blend.","&#8220;SIGNATURE SERIESA signature is a promise. A symbol of your identity. Your mark on the world. In 1999, Bodybuilding.com was founded on a single promise: Trust. It&#8217;s who we are and it&#8217;s in our blood. Our Signature line is built on the same promise. Every product is no-BS, transparent, filler-free, and formulated with effective doses of research-backed ingredients you can trust. We create the highest quality supplements, so you can focus on leaving a mark of your own.TOTAL TRANSPARENCYSignature products are formulated with high quality ingredients at effective doses that we&#8217;re proud to share with you. We don&#8217;t hide anything in a &#8220;proprietary blend&#8221;, so you always know exactly what you&#8217;re putting into your body.EFFECTIVE DOSESAn effective dose is the amount of an ingredient that has been shown to deliver results. Some supplement brands add a sprinkle of an ingredient just so they can say it&#8217;s in the product. Signature supplements always include enough to get the job done.RESEARCH-BACKED INGREDIENTSTrendy, flash-in-the-pan ingredients come and go. But time-tested, gym-proven ingredients are what you need to help you achieve your fitness goals. That&#8217;s what you&#8217;ll find in Signature products because that&#8217;s what works.&#8221;",https://shop.bodybuilding.com/products/bodybuilding-signature-whey-protein
Whey Protein,Pro Supps Whey Isolate,"ProSupps® Whey Isolate protein powder is made using a triple cold filtered WPI (whey protein isolate) that ensures the natural amino acid profile and valuable micro-fractions are kept intact. Formulated with 5g of anabolic Branched Chain Amino Acids (BCAAs), ProSupps Whey Isolate supplement also doesn't contain the added sugars and fillers commonly found in other proteins. Whey Isolate is specifically designed to build & maintain lean muscle mass while losing body fat, perfect for anyone training on a reduced calorie diet.

* ProSupps® Whey Isolate replaces ISO P3.Read more",SUGGESTED USE: Mix 1 serving of Whey Isolate in 6-8oz of cold water (adjust for taste and consistency) and mix thoroughly.,"These statements have not been evaluated by the Food and Drug Administration. This product is not intended to diagnose, treat, cure, or prevent any disease.",Supports Lean Muscle GrowthEnhances Muscle RepairImproves Exercise PerformanceFast Absorbing,"We started ProSupps as a small group of guys chasing our dreams. Our purpose remains simple &#8211; unlock the greatness within each one of us. When you buy a ProSupps product, you become one of us. We proudly celebrate you, our customers, those who display a unique brand of courage. An exceptional group of people who won&#8217;t let challenges stop them from achieving their goals.No matter where you are in your fitness journey, ProSupps will be there. Every rep of the way.",https://shop.bodybuilding.com/products/pro-supps-whey-isolate-1
Whey Protein,,,,,,,https://shop.bodybuilding.com/products/ryno-power-premium-whey-protein
Whey Protein,Pro Supps Whey Concentrate Vanilla,"Maximize your lean muscle growth with ProSupps® Whey Concentrate. We've packed 24g of premium whey protein in every scoop and rejected the fillers and additives you don't want. Formulated specifically for intense athletic training, ProSupps® Whey Concentrate is the premium choice for the daily protein you need to build, rebuild, and maintain lean muscle. Add to that our award-winning flavors and the choice is easy - ProSupps® Whey Concentrate. Now all you have to do is get out there and EARN IT…not worry about the quality of your protein.Read more","SUGGESTED USE: For a great tasting, delicious shake, combine 1 scoop of ProSupps&reg; Whey Concentrate with 6-8 oz of cold water (depending on personal preference for desired thickness). Use 2-3 servings daily for maximum protein uptake.","These statements have not been evaluated by the Food and Drug Administration. This product is not intended to diagnose, treat, cure, or prevent any disease.",Support Muscle GrowthSupports Muscle VolumeEnhances Muscle RepairGreat Tasting FlavorsEasy Mixability,"We started ProSupps as a small group of guys chasing our dreams. Our purpose remains simple &#8211; unlock the greatness within each one of us. When you buy a ProSupps product, you become one of us. We proudly celebrate you, our customers, those who display a unique brand of courage. An exceptional group of people who won&#8217;t let challenges stop them from achieving their goals.No matter where you are in your fitness journey, ProSupps will be there. Every rep of the way.",https://shop.bodybuilding.com/products/pro-supps-whey-concentrate
Whey Protein,Gym Molly Power Protein,Power Protein Is Ready to Give you Fuel Around the Clock with its Whey Protein Isolate Rich FormulaSupports Lean Muscle GrowthEnhances Muscle RepairImproves Exercise PerformanceFast AbsorbingRead more,Mix 1 scoop of Gym Molly Power Protein with 6 - 12oz of water or milk. Vary amount of liquid to taste.,"""This product is only intended for healthyadults. Immediately discontinue use and consult alicensed, qualified healthcare professional if youexperience any adverse reaction to this product.Store in a cool, dry place. Keep out of reach of children.Do not use if safety seal is broken or missing.""",,"Gym Molly is dedicated to helping people live their best lives through health & fitness. Since our November 2017 launch, we've produced only the highest quality supplements and created an international community of fitness enthusiasts. Our attention to detail & passion for innovation is why Gym Molly has been embraced by the largest retailers in America.",https://shop.bodybuilding.com/products/gym-molly-power-protein
Whey Protein,Prolab Nutrition Whey Isolate,"Prolab Whey Protein Isolate contains 23 Grams of Ultra-Pure, Fast Absorbing Protein to fuel muscle growth post performance.Read more",Mix 1 scoop with 6-8 fl. Oz. of cold water or your favorite beverage using a shaker cup or blender.,"Consult your physician before beginning a dietary regimen containing this product. If you are nursing, pregnant, or considering pregnancy, consult your healthcare professional prior to using this product.","Prolab Whey Protein Isolate contains 23 Grams of Ultra-Pure, Fast Absorbing Protein to fuel muscle growth post performance.",Prolab® Nutrition offers High-Quality Sports Nutrition for Athletes and Fitness Enthusiasts. Our products allow athletes to customize supplements specific to their training goals.,https://shop.bodybuilding.com/products/prolab-nutrition-whey-isolate
Whey Protein,Performance Inspired Nutrition Isolate Whey Protein,Whey Isolate Powder to Support Muscle Growth & RecoveryRead more,"Mix one scoop (35g) with 8-10 oz of cold water, milk or your favorite beverage and blend well. Use two scoops for 50 grams of protein on heavy demand days.","Use this product as a food supplement only. Do not use for weightreduction. Do not use as a sole source of nutrition for weight loss ormaintenance. Keep out of reach of children. Store in a cool, dry place.","No synthetic additives or fillers. Just honest, all-natural ingredients you can trust.  Check out our label, compare and you WILL trade-up to Performance Inspired","Co-founded by fitness fanatic, actor, and businessman Mark Wahlberg along with former GNC executives to create a line of quality, high value, all-natural products people can trust at a great price. Formulated for the everyday athlete and professionals that rely and trust our quality, clean, efficacious and robust formulas without unproven or artificial ingredients. Better nutrition and supplements to help you perform better, feel better and be our best naturally!  ",https://shop.bodybuilding.com/products/performance-inspired-nutrition-isolate-whey-protein
Whey Protein,Forzagen Forza Whey PRO Protein,"FORZA WHEY PRO is a must-have for maintaining dietary and lifestyle balance. It serves as the cornerstone for individuals leading an active lifestyle - providing the necessary protein not only for day-to-day functioning, but also for realizing our true potential. Our protein stands out with its exceptional taste and seamless mixing. 

Packed with 24 grams of protein per scoop.
Low in sugar, making it ideal for low carb diets.
Enhanced with digestive enzymes for easy digestion.
Fortified with essential minerals and electrolytes to support strength and hydration.
FACT: FORZA WHEY PRO is your undeniable partner in achieving your goals!Read more","Take 1 Scoop of Forza Whey Pro mix with 6 - 8 oz of water, Milk or your favorite beverage, shake for 30 seconds.",,Muscle Gain.,"At FORZAGEN we only have interest  in making the most straight forward and effective products for our customers; YOU. If we wouldn&#8217;t use it on a daily basis ourselves, how can we expect you too? FACT: FORZAGEN will undoubtedly help you achieve your goals!! It is in the very essence of our name:FORCE FROM WTHIN!!FORZA- in latin &#8220;esserte forte&#8221; can be translated into: &#8220;BE STRONG&#8220;, &#8220;FORCE&#8220; or &#8220;POWER&#8220;GEN&#8216;  of &#8220;deriving from&#8221; or &#8220;a thing that processes or causes&#8221;The idea to go through life and FIND YOURSELF,  goes far beyond the gym, the kitchen, the working spaces of the 21st century..it transcends into what WE CAN become and where we CAN GO!FORZAGEN wants you to see it through. So go beyond, find things about yourself, break the mold and become something NEW.",https://shop.bodybuilding.com/products/forzagen-forza-whey-pro-protein
Whey Protein,Amazing Nutrition Amazing Formulas Grass-Fed Whey Isolate,"Amazing formulas, grass fed whey protein isolate is a rich source of essential amino acids, which are the building blocks of protein and imprtant for those with an active lifestyle. Protein is a vital nutrient and responsible for building and repairing cells, muscle and producing energy for the body. The body requires higher amounts of protein during and after excersive to fuel the muscles,Read more","On training days, mix two (2) scoops in 12-16 oz. of water or a carbohydrate based post-workout beverage within 30 minutes of your workout. On non-training days, use one (1) scoop 1-3 times daily, in between or in addition to meals as a dietary supplement.","Use this product as a food supplement. Do not use for weight reduction. This product is only intended to be consumed by healthy individuals 18 years or older. Consult a physician if you are pregnant or nursing, taking any medications or have any medical condition. Do not exceed recommended use Improper use will not improve results. Discontinue use and seek professional assistance immediately f you experience unwanted side effects. Discontinue use two weeks prior to surgery.","ENCOURAGE MUSCLE GROWTH, SUPPORTS ENERGY PRODUCTION , SUPPORTS SWIFTER WORKOUT RECOVERY","Amazing Formulas&#8217; will have you living well and feeling better! We offer the finest selection of supplements, which can perfectly complement a healthy diet and active lifestyle. &#8216;Amazing Formulas™&#8217; helps you create a strong nutritional foundation with simple, clean yet effective formulas.",https://shop.bodybuilding.com/products/amazing-formulas-grass-fed-whey-isolate
Whey Protein,Legion Whey+ Whey Isolate Protein Powder,Get our 100% natural whey protein isolate powder made with Truly Grass Fed™ milk from small dairy farms in Ireland renowned for their superior and sustainable farming practicesRead more,,,,"Bestselling author Mike Matthews founded Legion to create healthy, high-quality sport supplements based on sound science, and to sell them honestly and at a fair price.",https://shop.bodybuilding.com/products/legion-whey-plus-whey-isolate-protein-powder
Whey Protein Isolate,Bodybuilding.com Signature 100% Whey Isolate,"Whey protein isolate is protein at its best. It has been filtered to remove the majority of the lactose, fat and carbs, making it higher in protein, leaner, and faster digesting than standard whey protein. Its quick release of amino acids is ideal for supporting post-workout muscle growth and recovery. Signature Isolate is delicious and fits any clean-eating plan with just 1 gram of sugar, minimal lactose, and only 1 gram of fat.Read more","Add one scoop to 6 ounces of cold water or milk and mix thoroughly. Our isolate is made with instantized proteins that mix easily - no clumps or grit. Enjoy pre- or post-workout, or anytime you need a delicious protein boost.","WARNINGS: Consult your physician before using this product if you're taking any medications or are under a physician's care for a medical condition. Not for use by those under the age of 18 or by women who are pregnant, trying to become pregnant, or are nursing.* THESE STATEMENTS HAVE NOT BEEN EVALUATED BY THE FOOD AND DRUG ADMINISTRATION. THIS PRODUCT IS NOT INTENDED TO DIAGNOSE, TREAT, CURE, OR PREVENT ANY DISEASE.WARNING: Use this product as a food supplement only. Do not use for weight reduction. Store in a cool, dry place. Keep out of reach of children.Made in a facility that processes milk, wheat, soy, egg, and tree nuts species (coconut).","All fitness goals need high-quality sources of protein to support your muscles and fuel results. Looking to build strength? You should be taking protein. Looking to build muscle? You should be taking protein. Looking to lose weight? You guessed it, you should be taking protein. Signature 100% Whey Isolate is a delicious protein that encourages muscle recovery and supports muscle growth. Stay on track with your goals without hurting your macros. This formula is ideal to support muscle recovery and growth after workouts or throughout the day as a healthy snack. It&#8217;s mixes easily in water, milk, or your favorite beverage for a delicious protein kick. Mix it in with oatmeal for a powerful performance breakfast.","&#8220;SIGNATURE SERIESA signature is a promise. A symbol of your identity. Your mark on the world. In 1999, Bodybuilding.com was founded on a single promise: Trust. It&#8217;s who we are and it&#8217;s in our blood. Our Signature line is built on the same promise. Every product is no-BS, transparent, filler-free, and formulated with effective doses of research-backed ingredients you can trust. We create the highest quality supplements, so you can focus on leaving a mark of your own.TOTAL TRANSPARENCYSignature products are formulated with high quality ingredients at effective doses that we&#8217;re proud to share with you. We don&#8217;t hide anything in a &#8220;proprietary blend&#8221;, so you always know exactly what you&#8217;re putting into your body.EFFECTIVE DOSESAn effective dose is the amount of an ingredient that has been shown to deliver results. Some supplement brands add a sprinkle of an ingredient just so they can say it&#8217;s in the product. Signature supplements always include enough to get the job done.RESEARCH-BACKED INGREDIENTSTrendy, flash-in-the-pan ingredients come and go. But time-tested, gym-proven ingredients are what you need to help you achieve your fitness goals. That&#8217;s what you&#8217;ll find in Signature products because that&#8217;s what works.&#8221;",https://shop.bodybuilding.com/products/bodybuilding-signature-whey-protein-isolate
Whey Protein Isolate,Pro Supps Whey Isolate,"ProSupps® Whey Isolate protein powder is made using a triple cold filtered WPI (whey protein isolate) that ensures the natural amino acid profile and valuable micro-fractions are kept intact. Formulated with 5g of anabolic Branched Chain Amino Acids (BCAAs), ProSupps Whey Isolate supplement also doesn't contain the added sugars and fillers commonly found in other proteins. Whey Isolate is specifically designed to build & maintain lean muscle mass while losing body fat, perfect for anyone training on a reduced calorie diet.

* ProSupps® Whey Isolate replaces ISO P3.Read more",SUGGESTED USE: Mix 1 serving of Whey Isolate in 6-8oz of cold water (adjust for taste and consistency) and mix thoroughly.,"These statements have not been evaluated by the Food and Drug Administration. This product is not intended to diagnose, treat, cure, or prevent any disease.",Supports Lean Muscle GrowthEnhances Muscle RepairImproves Exercise PerformanceFast Absorbing,"We started ProSupps as a small group of guys chasing our dreams. Our purpose remains simple &#8211; unlock the greatness within each one of us. When you buy a ProSupps product, you become one of us. We proudly celebrate you, our customers, those who display a unique brand of courage. An exceptional group of people who won&#8217;t let challenges stop them from achieving their goals.No matter where you are in your fitness journey, ProSupps will be there. Every rep of the way.",https://shop.bodybuilding.com/products/pro-supps-whey-isolate-1
Whey Protein Isolate,,,,,,,https://shop.bodybuilding.com/products/ryno-power-premium-whey-protein
Whey Protein Isolate,Prolab Nutrition Whey Isolate,"Prolab Whey Protein Isolate contains 23 Grams of Ultra-Pure, Fast Absorbing Protein to fuel muscle growth post performance.Read more",Mix 1 scoop with 6-8 fl. Oz. of cold water or your favorite beverage using a shaker cup or blender.,"Consult your physician before beginning a dietary regimen containing this product. If you are nursing, pregnant, or considering pregnancy, consult your healthcare professional prior to using this product.","Prolab Whey Protein Isolate contains 23 Grams of Ultra-Pure, Fast Absorbing Protein to fuel muscle growth post performance.",Prolab® Nutrition offers High-Quality Sports Nutrition for Athletes and Fitness Enthusiasts. Our products allow athletes to customize supplements specific to their training goals.,https://shop.bodybuilding.com/products/prolab-nutrition-whey-isolate
Whey Protein Isolate,Performance Inspired Nutrition Isolate Whey Protein,Whey Isolate Powder to Support Muscle Growth & RecoveryRead more,"Mix one scoop (35g) with 8-10 oz of cold water, milk or your favorite beverage and blend well. Use two scoops for 50 grams of protein on heavy demand days.","Use this product as a food supplement only. Do not use for weightreduction. Do not use as a sole source of nutrition for weight loss ormaintenance. Keep out of reach of children. Store in a cool, dry place.","No synthetic additives or fillers. Just honest, all-natural ingredients you can trust.  Check out our label, compare and you WILL trade-up to Performance Inspired","Co-founded by fitness fanatic, actor, and businessman Mark Wahlberg along with former GNC executives to create a line of quality, high value, all-natural products people can trust at a great price. Formulated for the everyday athlete and professionals that rely and trust our quality, clean, efficacious and robust formulas without unproven or artificial ingredients. Better nutrition and supplements to help you perform better, feel better and be our best naturally!  ",https://shop.bodybuilding.com/products/performance-inspired-nutrition-isolate-whey-protein
